{
  "schema": "media.provider_shape.v1",
  "providerId": "openai",
  "providerFamily": "openai-media",
  "authKind": "bearer-token",
  "endpoints": [
    {
      "schema": "media.provider_endpoint_shape.v1",
      "endpointId": "openai.image.generate",
      "providerId": "openai",
      "intentFamily": "image-generation",
      "operationKind": "generate-image",
      "requestShape": {
        "style": "provider-json-request",
        "fields": [
          "model",
          "prompt",
          "size",
          "quality",
          "background",
          "output_format"
        ]
      },
      "responseShape": {
        "style": "provider-image-response",
        "fields": [
          "created",
          "data",
          "b64_json",
          "url",
          "revised_prompt"
        ]
      },
      "asyncPattern": "synchronous",
      "outputDelivery": "inline-base64",
      "knownFailureModes": [
        "policy_rejected",
        "provider_failed",
        "rate_limited",
        "organization_verification_required"
      ],
      "localOnly": true,
      "meshTruth": false,
      "providerTruth": false,
      "createdAt": "2026-05-19T00:00:00.000Z"
    }
  ],
  "localOnly": true,
  "meshTruth": false,
  "providerTruth": false,
  "createdAt": "2026-05-19T00:00:00.000Z"
}
